{
  "promptId": "P05",
  "packVersion": "6.0.0",
  "architectureVersion": "5.0.0",
  "architectureIdentitySha256": "091dbc8629246eadd10581acbd41285c9b72ee1712bb1cddd0de783ec125d80b",
  "status": "PASS",
  "gitCommit": null,
  "dirty": null,
  "changedFiles": [
    "src/config/environment.ts",
    "src/domain/foundation.ts",
    "src/services/healthService.ts",
    "src/server/routes.ts",
    "src/server/app.ts",
    "src/testing/unit/config.test.ts",
    "src/testing/integration/api.test.ts",
    "src/App.tsx",
    "docs/implementation/BUILD_STATE.json",
    "docs/implementation/ENGINE_COVERAGE.csv"
  ],
  "commands": [
    {
      "command": "npm test",
      "state": "EXECUTED",
      "exitCode": 0
    }
  ],
  "checks": {
    "architecture": {
      "state": "PASS",
      "count": 0,
      "details": "Architecture canonical manifest verified (v5.0.0, 66 engines, 670 modules, SHA256 091dbc86... verified)"
    },
    "fixtures": {
      "state": "PASS",
      "count": 0,
      "details": "Zero fixture contamination detected in production paths"
    },
    "provenance": {
      "state": "PASS",
      "count": 0,
      "details": "Epistemic states and provenance contracts verified"
    },
    "claims": {
      "state": "NOT_APPLICABLE",
      "count": null,
      "details": null
    },
    "metrics": {
      "state": "NOT_APPLICABLE",
      "count": null,
      "details": null
    },
    "providers": {
      "state": "NOT_APPLICABLE",
      "count": null,
      "details": null
    },
    "ui": {
      "state": "NOT_APPLICABLE",
      "count": null,
      "details": null
    },
    "artist-safety": {
      "state": "NOT_APPLICABLE",
      "count": null,
      "details": null
    },
    "snapshots": {
      "state": "NOT_APPLICABLE",
      "count": null,
      "details": null
    },
    "security": {
      "state": "NOT_APPLICABLE",
      "count": null,
      "details": null
    },
    "negative-tests": {
      "state": "PASS",
      "count": 0,
      "details": "All controlled negative tests passed"
    },
    "receipt-schema": {
      "state": "PASS",
      "count": 0,
      "details": "Schema validated against v6 receipt schema"
    }
  },
  "providers": [
    {
      "name": "GEMINI_API",
      "status": "NOT_CONFIGURED",
      "liveVerificationPerformed": false,
      "verifiedAt": null
    },
    {
      "name": "SPOTIFY_API",
      "status": "NOT_CONFIGURED",
      "liveVerificationPerformed": false,
      "verifiedAt": null
    },
    {
      "name": "BILLBOARD_API",
      "status": "NOT_CONFIGURED",
      "liveVerificationPerformed": false,
      "verifiedAt": null
    },
    {
      "name": "GENIUS_API",
      "status": "NOT_CONFIGURED",
      "liveVerificationPerformed": false,
      "verifiedAt": null
    }
  ],
  "knownGaps": [],
  "generatedAt": "2026-09-05T02:05:11.239Z"
}