{
  "promptId": "P00A",
  "packVersion": "6.0.0",
  "architectureVersion": "5.0.0",
  "architectureIdentitySha256": "091dbc8629246eadd10581acbd41285c9b72ee1712bb1cddd0de783ec125d80b",
  "status": "PASS",
  "gitCommit": null,
  "dirty": null,
  "changedFiles": [
    "docs/implementation/PHASE_EVIDENCE_RECEIPT.schema.json",
    "docs/implementation/INTEGRITY_CHECK_MATRIX.csv",
    "docs/architecture/ARCHITECTURE_IDENTITY_V6.json",
    "tools/integrity/phase-verifier.ts",
    "tools/integrity/integrity-checker.ts"
  ],
  "commands": [
    {
      "command": "npm test",
      "state": "EXECUTED",
      "exitCode": 0
    }
  ],
  "checks": {
    "architecture": {
      "state": "PASS",
      "count": 0,
      "details": "Architecture canonical manifest verified (v5.0.0, 66 engines, 670 modules, SHA256 091dbc86... verified)"
    },
    "fixtures": {
      "state": "PASS",
      "count": 0,
      "details": "Zero fixture contamination detected in production paths"
    },
    "provenance": {
      "state": "NOT_APPLICABLE",
      "count": null,
      "details": null
    },
    "claims": {
      "state": "NOT_APPLICABLE",
      "count": null,
      "details": null
    },
    "metrics": {
      "state": "NOT_APPLICABLE",
      "count": null,
      "details": null
    },
    "providers": {
      "state": "NOT_APPLICABLE",
      "count": null,
      "details": null
    },
    "ui": {
      "state": "NOT_APPLICABLE",
      "count": null,
      "details": null
    },
    "artist-safety": {
      "state": "NOT_APPLICABLE",
      "count": null,
      "details": null
    },
    "snapshots": {
      "state": "NOT_APPLICABLE",
      "count": null,
      "details": null
    },
    "security": {
      "state": "NOT_APPLICABLE",
      "count": null,
      "details": null
    },
    "negative-tests": {
      "state": "PASS",
      "count": 0,
      "details": "All controlled negative tests passed"
    },
    "receipt-schema": {
      "state": "PASS",
      "count": 0,
      "details": "Schema validated against v6 receipt schema"
    }
  },
  "providers": [
    {
      "name": "GEMINI_API",
      "status": "NOT_CONFIGURED",
      "liveVerificationPerformed": false,
      "verifiedAt": null
    },
    {
      "name": "SPOTIFY_API",
      "status": "NOT_CONFIGURED",
      "liveVerificationPerformed": false,
      "verifiedAt": null
    },
    {
      "name": "BILLBOARD_API",
      "status": "NOT_CONFIGURED",
      "liveVerificationPerformed": false,
      "verifiedAt": null
    },
    {
      "name": "GENIUS_API",
      "status": "NOT_CONFIGURED",
      "liveVerificationPerformed": false,
      "verifiedAt": null
    }
  ],
  "knownGaps": [],
  "generatedAt": "2026-09-03T23:54:57.225Z"
}